{
  "v": 1,
  "type": "handshake.ack",
  "session_id": "11111111-1111-1111-1111-111111111111",
  "seq": 0,
  "timestamp_sim": 0.0,
  "sender_id": "00000000-0000-0000-0000-000000000000",
  "authority": "server",
  "payload": {
    "client_id": "22222222-2222-2222-2222-222222222222",
    "session_id": "11111111-1111-1111-1111-111111111111",
    "display_name": "Alice",
    "proto_version": 1
  }
}
